{
  "schema_version": 1,
  "project_license": "Apache-2.0",
  "allowed": [
    "0BSD",
    "Apache-2.0",
    "BSD-2-Clause",
    "BSD-3-Clause",
    "EPL-2.0",
    "ISC",
    "LGPL-2.1-only",
    "LGPL-3.0-only",
    "MIT",
    "MPL-2.0",
    "Python-2.0"
  ],
  "separate_process_allowed": [
    "AGPL-3.0-only",
    "GPL-2.0-or-later",
    "GPL-2.0-only",
    "GPL-3.0-only"
  ]
}
